<?xml version="1.0" encoding="UTF-8" standalone="no" ?>
<el:level xmlns:xsi="http://www.w3.org/2001/XMLSchema-instance" xsi:schemaLocation="http://enigma-game.org/schema/level/1 level.xsd" xmlns:el="http://enigma-game.org/schema/level/1">
  <el:protected>
    <el:info el:type="level">
      <el:identity el:title="Invisible Path" el:subtitle="Oxyd Extra 17" el:id="oxe17"/>
      <el:version el:score="1" el:release="2" el:revision="2" el:status="released"/>
      <el:author el:name="Raoul Bourquin" el:email=""/>
      <el:copyright>Copyright Â© 2013 Raoul Bourquin</el:copyright>
      <el:license el:type="GPL v2.0 or above" el:open="true"/>
      <el:compatibility el:engine="oxyd.extra" el:enigma="1.30"/>
      <el:modes el:easy="false" el:single="true" el:network="false"/>
      <el:score el:easy="-" el:difficult="-"/>
    </el:info>
    <el:luamain><![CDATA[
ti["  "] = {"fl_gray"}
ti[". "] = {"fl_ivory"}
ti["- "] = {"fl_dark"}
ti[" #"] = {"st_invisible"}
ti[" O"] = {"st_oxyd", flavor="a"}
ti[" @"] = {"#ac_marble_black"}

wo(res.composer(ti), "  ", {
    " #.# #.# #.# #.# #.# #.# #.# #.# #.# #.#",
    ".#- . - . - . - .#- . -#.#-#. - . - . -#",
    " #.# #.O #.# #.   .#  .   .   .# O.#  .#",
    ".#- . - . - . -#. - . -#.#-#. - . -#. -#",
    " #.  #.# #.  #.# #.#  .   .  #.  #.   .#",
    ".#- .#-O.#- . - . -#. -#. -#.#-#.O- .#-#",
    " #.  #.   .  #.  #.  @.#  .  #.# #.#  .#",
    ".#- . -#.#- .#- .#-#. -#.#- . - . -#. -#",
    " #.  #.O #.  #.   .   .#  .#  .# O.#  .#",
    ".#- . - .#- .#- .#-#.#-#. - . - . - . -#",
    " #.# #.# #.# #.# #.# #.# #.# #.# #.# #.#"})

wo:shuffleOxyd()
 ]]></el:luamain>
    <el:i18n>
      <el:string el:key="title">
        <el:english el:translate="false"/>
      </el:string>
    </el:i18n>
  </el:protected>
</el:level>
